{
  "description": "Synthetic test data",
  "context": "Synthetic test data",
  "bundles": [
    "synth-app"
  ],
  "arguments": [
    {
      "name": "name",
      "type": "string"
    }
  ],
  "format_intent": "text",
  "max_length": 200,
  "source_revision": "67b44d65f1fe898fbb88d015b8aff4908d28d6bb7ee49bed071801d6330f1b97",
  "risk": "account",
  "auto_merge": true,
  "surfaces": [
    "synthetic-fixture"
  ]
}
